{"$schema":"https://json-schema.org/draft/2020-12/schema","$id":"https://contracts.pulse-ivonix.site/identity/auth-claims/v1","title":"PULSE Auth Claims v1","type":"object","additionalProperties":false,"required":["sub","iat","exp","organization_id","org_id","role","scopes","actor_type","session_id","iss","aud"],"properties":{"sub":{"type":"string","minLength":1},"iat":{"type":"integer","minimum":0},"exp":{"type":"integer","minimum":1},"organization_id":{"type":"string","minLength":1},"org_id":{"type":"string","minLength":1},"role":{"enum":["owner","admin","operator","viewer"]},"scopes":{"type":"array","items":{"type":"string","minLength":1},"uniqueItems":true},"actor_type":{"enum":["user","service","device","founder"]},"session_id":{"type":"string","minLength":1},"iss":{"const":"pulse"},"aud":{"const":"pulse-api"}}}