{"sub":"01HZ8X2K5M6P7Q8R9S0T1V2W6C","iat":1736938200,"exp":1736941800,"organization_id":"01HZ8X2K5M6P7Q8R9S0T1V2W5Z","org_id":"01HZ8X2K5M6P7Q8R9S0T1V2W5Z","role":"operator","scopes":["devices:read","devices:write"],"actor_type":"user","session_id":"01HZ8X2K5M6P7Q8R9S0T1V2W6D","iss":"pulse","aud":"pulse-api"}